{
  "$schema": "http://json-schema.org/draft-07/schema#",
  "$id": "https://sam-framework.dev/schemas/item.schema.json",
  "title": "S.A.M Item / Weapon",
  "description": "Defines a custom item or weapon. S.A.M registers it into the items[] table at a reserved runtime slot (>=5000) and wires up its names, category, slot, weight, value, level, attributes and 2D inventory icon. Custom 3D models and on-hit effects are PLANNED and not yet loaded \u2014 see each field's note.",
  "type": "object",
  "additionalProperties": false,
  "required": [
    "id",
    "name_identified",
    "category"
  ],
  "properties": {
    "$schema": {
      "type": "string",
      "description": "Optional. URL of this JSON Schema, so editors give autocomplete + validation as you type. Ignored by S.A.M itself."
    },
    "id": {
      "type": "string",
      "pattern": "^[a-z][a-z0-9_]*:[a-z][a-z0-9_]*$",
      "description": "Unique item id in 'namespace:item' form (e.g. 'darkblade:shadowblade'). S.A.M assigns the runtime numeric item slot (>=5000) automatically."
    },
    "name_identified": {
      "type": "string",
      "minLength": 1,
      "description": "Item name shown once identified (e.g. 'Shadowblade')."
    },
    "name_unidentified": {
      "type": "string",
      "description": "Item name shown before identification (e.g. 'black sword')."
    },
    "description": {
      "type": "string",
      "description": "Optional. Hover-tooltip body text shown in-game (use \\n for line breaks). If omitted, the tooltip falls back to the item's name. Replaces the 'this item does not have a tooltip yet' placeholder."
    },
    "category": {
      "enum": [
        "WEAPON",
        "ARMOR",
        "AMULET",
        "POTION",
        "SCROLL",
        "MAGICSTAFF",
        "RING",
        "SPELLBOOK",
        "GEM",
        "THROWN",
        "TOOL",
        "FOOD",
        "BOOK",
        "SPELL_CAT",
        "TOME_SPELL"
      ],
      "description": "Item category (Barony Category enum, from items.hpp). Governs how the game classifies the item."
    },
    "slot": {
      "enum": [
        "EQUIPPABLE_IN_SLOT_WEAPON",
        "EQUIPPABLE_IN_SLOT_SHIELD",
        "EQUIPPABLE_IN_SLOT_MASK",
        "EQUIPPABLE_IN_SLOT_HELM",
        "EQUIPPABLE_IN_SLOT_GLOVES",
        "EQUIPPABLE_IN_SLOT_BOOTS",
        "EQUIPPABLE_IN_SLOT_BREASTPLATE",
        "EQUIPPABLE_IN_SLOT_CLOAK",
        "EQUIPPABLE_IN_SLOT_AMULET",
        "EQUIPPABLE_IN_SLOT_RING",
        "NO_EQUIP"
      ],
      "default": "NO_EQUIP",
      "description": "Equipment slot the item occupies (Barony ItemEquippableSlot enum). Use NO_EQUIP for non-equippable items."
    },
    "weapon_skill": {
      "type": "string",
      "description": "Which weapon skill this trains and scales off. Barony works a weapon's skill out from a hardcoded list of vanilla item types, so a custom weapon matches none of them and gets no skill at all: no skill increase from using it, no damage variance, no durability scaling, and the tooltip claims Sword. Set this and it behaves as the weapon it is. Melee only: a ranged weapon cannot be custom (firing is gated on a hardcoded list of vanilla bows), and for a throwable set category THROWN instead, which trains Ranged and already works. Only meaningful on an equippable weapon; defaults to sword.",
      "enum": [
        "sword",
        "axe",
        "mace",
        "polearm"
      ],
      "default": "sword"
    },
    "sounds": {
      "type": "object",
      "additionalProperties": {
        "type": "string"
      },
      "description": "What whoever holds or wears this item plays instead of these vanilla sounds -- a sword with its own swing ({ \"SwingWeapon\": \"whoosh\" }), boots with their own footsteps ({ \"LeatherSteps\": \"clank\" }). Keys are vanilla names or groups, values are sound ids; a bare name is one of your own."
    },
    "traits": {
      "type": "array",
      "description": "Engine behaviours this item opts into. Barony answers questions like 'is this a bow?' or 'can this hold arrows?' from hardcoded lists of vanilla item types, and a custom item can never be on those lists. Naming a trait here puts it on. A trait makes the item RECOGNISED; what it then does is up to your script.",
      "items": {
        "type": "string",
        "enum": [
          "ranged",
          "quiver",
          "foci",
          "instrument",
          "thrown_ball",
          "shield_slot",
          "potion_bad",
          "automaton_food",
          "tinker_throwable",
          "usable",
          "beatitude_ac"
        ]
      },
      "uniqueItems": true
    },
    "weight": {
      "type": "integer",
      "minimum": 0,
      "description": "Item weight in Barony weight units."
    },
    "gold_value": {
      "type": "integer",
      "minimum": 0,
      "description": "Base gold value of the item."
    },
    "level": {
      "type": "integer",
      "minimum": -1,
      "description": "Item level for random-generation curves. -1 excludes the item from random generation."
    },
    "model": {
      "type": "string",
      "description": "Ship your OWN 3D model: a mod-relative path to a .vox, e.g. \"models/mymod/sword.vox\". SAM loads it at runtime and uses it as this item's world (and inventory) model, overriding 'model_from_item'. The path is also the model's id, so namespace your folder (models/<yourmod>/...) to avoid clashing with vanilla or another mod. Both Barony's slab .vox AND a MagicaVoxel .vox are accepted: a MagicaVoxel export is converted in memory when the mod loads, so there is nothing to convert by hand and the file on disk is left alone. Two caveats: a file holding several models uses only the first, and a model saved on MagicaVoxel's untouched default palette carries no palette chunk, so recolour any voxel before saving. An unknown/failed path is skipped with a warning and the item falls back to 'model_from_item' or a placeholder."
    },
    "model_fp": {
      "type": "string",
      "description": "Optional separate .vox for the FIRST-PERSON / held view (same rules as 'model'). If omitted, the held view reuses 'model'."
    },
    "model_from_item": {
      "type": "string",
      "description": "Reuse an existing vanilla item's 3D model (world + first-person + inventory icon) for this custom item, by vanilla ItemType name \u2014 e.g. \"SILVER_SHIELD\", \"STEEL_SWORD\", \"IRON_HELM\". This is the supported way to give a custom item a real model. If omitted, the item clones a placeholder that matches its equip slot (a shield looks like a wooden shield, boots like boots, etc.). If the name is unknown, the placeholder is used and a warning is logged. A per-item 'icon' PNG still overrides the 2D inventory icon. On gloves and boots it also picks the vanilla pair drawn on the body, unless 'worn_like' names another."
    },
    "worn_like": {
      "type": "string",
      "description": "Which vanilla item this one is worn like on the body, by vanilla ItemType name from the same slot, e.g. \"HAT_BOUNTYHUNTER\". HATS AND MASKS with their own 'model': the game places a hat or mask by matching its model against its own, and a mod's model matches none, so it is worn exactly as built. A model built lying on its side, the way the game's own hats are, then sits sideways on the head. Naming the vanilla hat it should sit like places it there on every body: its turn, its height, and how it fits with a mask. GLOVES AND BOOTS: the game draws these by swapping in whole arm and leg models from its own list, so a mod's own model never shows on the body. This picks which vanilla pair is drawn. Without it: the item model_from_item names, if that is gloves (or boots), otherwise plain GLOVES or LEATHER_BOOTS. Ignored, with a warning in sam_log.txt, for any other slot, an unknown name, or an item from a different slot. worn_like belongs to the model FILE: every hat or mask that uses the same .vox sits the same way, and sam_log.txt names any item that shares one. A hat or mask with no model of its own (no 'model' and no 'model_states') does not need it: it already sits where the item its model came from sits. The exception is a mask borrowing the TOOL_GLASSES or MONOCLE model: the game wears those as separate models picked by item type, so such a mask shows the floor model at the usual mask spot. To sit like glasses, give it its own model and worn_like."
    },
    "icon": {
      "type": "string",
      "description": "Path (relative to the mod folder) to a PNG used as the item's 2D inventory/hotbar icon, e.g. 'items/shadowblade.png'. Loaded at runtime and drawn like the class-select portrait. If the file is missing, a placeholder icon cloned from a similar vanilla item is used. (Only the 2D icon is loaded \u2014 the 3D 'model'/'model_fp' are supported via the model field below.)"
    },
    "kit_ui": {
      "type": "object",
      "additionalProperties": {
        "type": "string"
      },
      "description": "Your own art for the crafting panel this item opens when a recipe names it as its 'kit'. Keys are panel roles, values are mod-relative PNG paths: { \"base\": \"ui/my_base.png\", \"drawer\": \"ui/my_drawer.png\" }. Every role is optional and anything you leave out keeps the vanilla art. A role the game does not know is simply never asked for, so an older build still loads a newer mod, and a path that points outside the mod folder is dropped with a warning. The role names and the pixel size each one has to match are listed in docs/tinkering-recipes.md."
    },
    "attributes": {
      "type": "object",
      "description": "Numeric values the engine reads off this item. Recognised keys: ATK (added by attackGetAttack for weapons), AC (added by armorGetAC for armor and shields), TINKER_SALVAGE_METAL and TINKER_SALVAGE_MAGIC (what this yields when salvaged), spellbook_spell (the spell this SPELLBOOK teaches or casts, as a spell id), and foci_spell (the spell a shield-slot focus channels, as a spell id). Any other key is kept on the item and never looked at: there is no script call that reads a custom attribute back, so an invented key like EFF_UNBREAKABLE does nothing. A custom key has to be a whole number; anything else is dropped when the mod loads.",
      "additionalProperties": {
        "type": "integer"
      },
      "properties": {
        "ATK": {
          "type": "integer",
          "description": "Attack bonus. Read for weapons; ignored on non-weapons."
        },
        "AC": {
          "type": "integer",
          "description": "Armor Class bonus. Read for armor and shields; ignored on other categories."
        },
        "TINKER_SALVAGE_METAL": {
          "type": "integer",
          "minimum": 0,
          "description": "Metal scrap this item yields when salvaged at a tinkering kit. Omit it and the item cannot be broken down. Keep the yield BELOW the item's crafting cost, or a player can mint scrap forever by crafting and salvaging the same item."
        },
        "TINKER_SALVAGE_MAGIC": {
          "type": "integer",
          "minimum": 0,
          "description": "Magic scrap this item yields when salvaged at a tinkering kit. Omit it and the item cannot be broken down. Keep the yield BELOW the item's crafting cost."
        },
        "spellbook_spell": {
          "type": [
            "integer",
            "string"
          ],
          "description": "Spell this book teaches. A vanilla spell name (\"SPELL_FIREBALL\"), a numeric spell id, or your own \"namespace:spell\"."
        },
        "foci_spell": {
          "type": [
            "integer",
            "string"
          ],
          "description": "Spell this focus channels. Vanilla name, numeric id, or \"namespace:spell\"."
        },
        "tome_spell": {
          "type": [
            "integer",
            "string"
          ],
          "description": "Spell this tome teaches. Vanilla name, numeric id, or \"namespace:spell\"."
        },
        "magicstaff_spell": {
          "type": [
            "integer",
            "string"
          ],
          "description": "Spell this magic staff casts when swung. Vanilla name, numeric id, or \"namespace:spell\"."
        }
      }
    },
    "on_hit_effect": {
      "type": "string",
      "description": "PLANNED \u2014 requires the S.A.M effect/plugin system, which is not yet implemented. Parsed but has no runtime effect. Status effect to apply on a successful hit (e.g. an EFF_ effect name from stat.hpp)."
    },
    "on_hit_chance": {
      "type": "number",
      "minimum": 0,
      "maximum": 1,
      "description": "PLANNED \u2014 no runtime effect yet (see 'on_hit_effect'). Probability (0.0-1.0) that on_hit_effect triggers on a hit."
    },
    "stackable": {
      "type": "boolean",
      "default": false,
      "description": "PLANNED \u2014 parsed but not yet applied at runtime. Whether multiple copies stack into one inventory slot."
    },
    "magic_level": {
      "type": "integer",
      "description": "PLANNED \u2014 parsed but not yet applied at runtime. Magic/enchantment level of the item."
    },
    "model_states": {
      "type": "object",
      "additionalProperties": false,
      "description": "A different world model depending on the item's state. Checked most specific first: broken, then cursed, then blessed, then unidentified. Any state you leave out uses the ordinary model.",
      "properties": {
        "broken": {
          "type": "string"
        },
        "cursed": {
          "type": "string"
        },
        "blessed": {
          "type": "string"
        },
        "unidentified": {
          "type": "string"
        }
      }
    },
    "model_fp_states": {
      "type": "object",
      "additionalProperties": false,
      "description": "The same, for the first-person model you see while holding it.",
      "properties": {
        "broken": {
          "type": "string"
        },
        "cursed": {
          "type": "string"
        },
        "blessed": {
          "type": "string"
        },
        "unidentified": {
          "type": "string"
        }
      }
    }
  },
  "examples": [
    {
      "id": "darkblade:shadowblade",
      "name_identified": "Shadowblade",
      "name_unidentified": "black sword",
      "category": "WEAPON",
      "slot": "EQUIPPABLE_IN_SLOT_WEAPON",
      "weight": 3,
      "gold_value": 400,
      "level": 6,
      "model": "models/shadowblade.vox",
      "model_fp": "models/shadowblade_fp.vox",
      "icon": "icons/shadowblade.png",
      "attributes": {
        "ATK": 4,
        "AC": 2
      },
      "on_hit_effect": "EFF_BLIND",
      "on_hit_chance": 0.25,
      "stackable": false,
      "magic_level": 2
    }
  ]
}
